{
  "format_version": 1,
  "label": "ILLUSTRATIVE motion plan: INTENT ONLY (what the robot is asked to do). A full trial with no faults in it. What actually happened is in the executed timeline.",
  "data_status": "illustrative",
  "plan_id": "T008",
  "trial": 8,
  "trial_start_minute": 1680,
  "layout_id": "robot_cell_v1",
  "batch_size_g": 20.0,
  "recipe": {
    "drug_pct": 14.1,
    "filler_pct": 75.8,
    "binder_pct": 4.3,
    "disintegrant_pct": 5.2,
    "lubricant_pct": 0.6,
    "compression_force_kn": 11.0,
    "blend_time_min": 18
  },
  "why": "Chosen from 7 measured results (illustrative text).",
  "step_totals_s": {
    "dispense": 1800,
    "mix": 2700,
    "press": 1800,
    "test": 4500,
    "clean": 3600
  },
  "time_note": "start_s and duration_s are seconds since the start of the trial. Every action follows the one before it with no gap; waiting is an explicit wait action.",
  "actions": [
    {"id": "A001", "step": "dispense", "phase": "act", "type": "pick", "start_s": 0, "duration_s": 60, "object": "vial", "from": "rack", "caption": "Pick the vial from the rack."},
    {"id": "A002", "step": "dispense", "phase": "act", "type": "scan", "start_s": 60, "duration_s": 60, "object": "vial", "at": "rack", "caption": "Hold the vial to the barcode scanner (read only)."},
    {"id": "A003", "step": "dispense", "phase": "act", "type": "place", "start_s": 120, "duration_s": 60, "object": "vial", "to": "balance", "caption": "Place the vial on the balance."},
    {"id": "A004", "step": "dispense", "phase": "act", "type": "wait", "start_s": 180, "duration_s": 120, "reason": "balance tare and stabilisation before dosing", "caption": "The balance tares and settles."},
    {"id": "A005", "step": "dispense", "phase": "act", "type": "pick", "start_s": 300, "duration_s": 60, "object": "bottle_drug", "from": "slot_1", "caption": "Pick the drug (active) bottle from its slot."},
    {"id": "A006", "step": "dispense", "phase": "act", "type": "pour", "start_s": 360, "duration_s": 120, "object": "bottle_drug", "into": "vial", "at": "balance", "amount_g": 2.82, "caption": "Pour the drug (active), weighed on the balance."},
    {"id": "A007", "step": "dispense", "phase": "act", "type": "place", "start_s": 480, "duration_s": 60, "object": "bottle_drug", "to": "slot_1", "caption": "Return the drug (active) bottle to its slot."},
    {"id": "A008", "step": "dispense", "phase": "act", "type": "pick", "start_s": 540, "duration_s": 60, "object": "bottle_filler", "from": "slot_2", "caption": "Pick the filler bottle from its slot."},
    {"id": "A009", "step": "dispense", "phase": "act", "type": "pour", "start_s": 600, "duration_s": 240, "object": "bottle_filler", "into": "vial", "at": "balance", "amount_g": 15.16, "caption": "Pour the filler, weighed on the balance."},
    {"id": "A010", "step": "dispense", "phase": "act", "type": "place", "start_s": 840, "duration_s": 60, "object": "bottle_filler", "to": "slot_2", "caption": "Return the filler bottle to its slot."},
    {"id": "A011", "step": "dispense", "phase": "act", "type": "pick", "start_s": 900, "duration_s": 60, "object": "bottle_binder", "from": "slot_3", "caption": "Pick the binder bottle from its slot."},
    {"id": "A012", "step": "dispense", "phase": "act", "type": "pour", "start_s": 960, "duration_s": 90, "object": "bottle_binder", "into": "vial", "at": "balance", "amount_g": 0.86, "caption": "Pour the binder, weighed on the balance."},
    {"id": "A013", "step": "dispense", "phase": "act", "type": "place", "start_s": 1050, "duration_s": 60, "object": "bottle_binder", "to": "slot_3", "caption": "Return the binder bottle to its slot."},
    {"id": "A014", "step": "dispense", "phase": "act", "type": "pick", "start_s": 1110, "duration_s": 60, "object": "bottle_disintegrant", "from": "slot_4", "caption": "Pick the disintegrant bottle from its slot."},
    {"id": "A015", "step": "dispense", "phase": "act", "type": "pour", "start_s": 1170, "duration_s": 100, "object": "bottle_disintegrant", "into": "vial", "at": "balance", "amount_g": 1.04, "caption": "Pour the disintegrant, weighed on the balance."},
    {"id": "A016", "step": "dispense", "phase": "act", "type": "place", "start_s": 1270, "duration_s": 60, "object": "bottle_disintegrant", "to": "slot_4", "caption": "Return the disintegrant bottle to its slot."},
    {"id": "A017", "step": "dispense", "phase": "act", "type": "pick", "start_s": 1330, "duration_s": 60, "object": "bottle_lubricant", "from": "slot_5", "caption": "Pick the lubricant bottle from its slot."},
    {"id": "A018", "step": "dispense", "phase": "act", "type": "pour", "start_s": 1390, "duration_s": 80, "object": "bottle_lubricant", "into": "vial", "at": "balance", "amount_g": 0.12, "caption": "Pour the lubricant, weighed on the balance."},
    {"id": "A019", "step": "dispense", "phase": "act", "type": "place", "start_s": 1470, "duration_s": 60, "object": "bottle_lubricant", "to": "slot_5", "caption": "Return the lubricant bottle to its slot."},
    {"id": "A020", "step": "dispense", "phase": "act", "type": "read", "start_s": 1530, "duration_s": 30, "at": "balance", "quantity": "mass_g", "caption": "Check the total mass on the balance."},
    {"id": "A021", "step": "dispense", "phase": "act", "type": "wait", "start_s": 1560, "duration_s": 240, "reason": "powder settling and balance stabilisation after dosing", "caption": "Wait for the weighed powder to settle."},
    {"id": "A022", "step": "mix", "phase": "act", "type": "pick", "start_s": 1800, "duration_s": 60, "object": "vial", "from": "balance", "caption": "Pick up the vial to mix."},
    {"id": "A023", "step": "mix", "phase": "act", "type": "shake", "start_s": 1860, "duration_s": 1080, "object": "vial", "style": "mix", "caption": "Shake the vial to mix (the blend time)."},
    {"id": "A024", "step": "mix", "phase": "act", "type": "place", "start_s": 2940, "duration_s": 60, "object": "vial", "to": "balance", "caption": "Put the vial back on the balance."},
    {"id": "A025", "step": "mix", "phase": "act", "type": "wait", "start_s": 3000, "duration_s": 1500, "reason": "blend rest: de-aeration and static discharge before pressing", "caption": "Let the blend rest."},
    {"id": "A026", "step": "press", "phase": "act", "type": "pick", "start_s": 4500, "duration_s": 60, "object": "vial", "from": "balance", "caption": "Pick up the vial."},
    {"id": "A027", "step": "press", "phase": "act", "type": "pour", "start_s": 4560, "duration_s": 90, "object": "vial", "into": "press", "at": "press", "amount_g": 20.0, "caption": "Pour the blend into the die."},
    {"id": "A028", "step": "press", "phase": "act", "type": "place", "start_s": 4650, "duration_s": 60, "object": "vial", "to": "discard", "caption": "Drop the empty vial into the discard bin."},
    {"id": "A029", "step": "press", "phase": "act", "type": "pick", "start_s": 4710, "duration_s": 60, "object": "punch", "from": "punch_holder", "caption": "Pick up the press punch."},
    {"id": "A030", "step": "press", "phase": "act", "type": "press", "start_s": 4770, "duration_s": 60, "object": "punch", "at": "press", "force_kn": 11.0, "caption": "Push the punch down to form the tablet."},
    {"id": "A031", "step": "press", "phase": "act", "type": "place", "start_s": 4830, "duration_s": 60, "object": "punch", "to": "punch_holder", "caption": "Return the punch to its holder."},
    {"id": "A032", "step": "press", "phase": "act", "type": "wait", "start_s": 4890, "duration_s": 1410, "reason": "tablet elastic recovery and die cooling before handling", "caption": "Let the tablet relax and the die cool."},
    {"id": "A033", "step": "test", "phase": "sense", "type": "pick", "start_s": 6300, "duration_s": 60, "object": "tablet", "from": "press", "caption": "Pick the tablet out of the die."},
    {"id": "A034", "step": "test", "phase": "sense", "type": "place", "start_s": 6360, "duration_s": 60, "object": "tablet", "to": "gauge", "caption": "Place the tablet on the hardness gauge."},
    {"id": "A035", "step": "test", "phase": "sense", "type": "read", "start_s": 6420, "duration_s": 60, "at": "gauge", "quantity": "hardness_kp", "caption": "The gauge shows hardness. The robot only reads the number."},
    {"id": "A036", "step": "test", "phase": "sense", "type": "pick", "start_s": 6480, "duration_s": 60, "object": "tablet", "from": "gauge", "caption": "Pick the tablet up again."},
    {"id": "A037", "step": "test", "phase": "sense", "type": "place", "start_s": 6540, "duration_s": 60, "object": "tablet", "to": "friabilator", "caption": "Place the tablet in the friability tester."},
    {"id": "A038", "step": "test", "phase": "sense", "type": "wait", "start_s": 6600, "duration_s": 300, "reason": "friability drum tumbling the tablet for a fixed number of rotations", "caption": "The friability drum tumbles the tablet."},
    {"id": "A039", "step": "test", "phase": "sense", "type": "read", "start_s": 6900, "duration_s": 60, "at": "friabilator", "quantity": "friability_pct", "caption": "The tester shows friability."},
    {"id": "A040", "step": "test", "phase": "sense", "type": "pick", "start_s": 6960, "duration_s": 60, "object": "tablet", "from": "friabilator", "caption": "Pick the tablet out of the friability tester."},
    {"id": "A041", "step": "test", "phase": "sense", "type": "place", "start_s": 7020, "duration_s": 60, "object": "tablet", "to": "vessel", "caption": "Drop the tablet into the dissolution vessel."},
    {"id": "A042", "step": "test", "phase": "sense", "type": "pick", "start_s": 7080, "duration_s": 60, "object": "rod", "from": "rod_holder", "caption": "Pick up the stirring rod."},
    {"id": "A043", "step": "test", "phase": "sense", "type": "stir", "start_s": 7140, "duration_s": 1800, "object": "rod", "at": "vessel", "caption": "Stir the vessel for the 30-minute dissolution test."},